{
  "schema_name": "case-adjudication",
  "adjudication_revision": 1,
  "case_id": "public-5gc-baseline-user-plane",
  "capture_file": "pdu-session-user-plane.pcap",
  "capture_sha256": "6040d3e54f79926d9ae2db70664fc1342d98716ab5c9ec00e147dae079ee81f7",
  "runtime_provenance": {
    "corenet_commit": "603075bcb550225acd10bc5df5dacf33ce0e4589",
    "source_commit": "82934c2cc231540fa425e48177d4bed33210bfc1",
    "tshark_version": "TShark (Wireshark) 4.7.1 (v4.7.1-0-g667ab240e6de)",
    "domain_skill_versions": {
      "5gc-registration-mobility": "0.2.1",
      "5gc-pdu-session": "0.4.1",
      "5gc-handover-mobility": "0.1.1"
    }
  },
  "protocol_health": {
    "ngap": "SUCCESS",
    "nas-5gs": "SUCCESS_WITH_PROTECTED_PAYLOAD"
  },
  "human_baseline_status": "NO_SUPPORTED_ABNORMAL_BOUNDARY_OBSERVED",
  "comparison_status": "NEEDS_ADJUDICATION",
  "first_differing_layer": "DOMAIN_DEVIATION_EMISSION",
  "status_counts": {
    "SUPPORTED_BY_PACKET_EVIDENCE": 0,
    "VALID_CAPTURE_LIMITATION": 8,
    "POTENTIALLY_SPURIOUS": 2,
    "UNSUPPORTED_BY_PACKET_EVIDENCE": 5,
    "INSUFFICIENT_EVIDENCE": 0,
    "OUT_OF_IMPLEMENTED_SCOPE": 0
  },
  "adjudications": [
    {
      "kind": "DOMAIN_DEVIATION",
      "source_domain": "5gc-registration-mobility",
      "source_instance_id": "5gc-reg:pdu-session-user-plane.pcap:sctp-assoc-65535:r1",
      "candidate_id": null,
      "deviation_type": "MISSING_EXPECTED_COUNTERPART",
      "stage_id": "security-mode",
      "status": "VALID_CAPTURE_LIMITATION",
      "finality": "FINAL",
      "evidence_level": "DERIVED",
      "observation_ref": {
        "capture_file": "pdu-session-user-plane.pcap",
        "frame_number": null,
        "window_first_frame": 1,
        "window_last_frame": 17,
        "protocol": null,
        "message_type": null
      },
      "packet_evidence": [
        {
          "capture_file": "pdu-session-user-plane.pcap",
          "frame_number": 1,
          "field": "nas-5gs.security_header_type",
          "observed_value": "0"
        },
        {
          "capture_file": "pdu-session-user-plane.pcap",
          "frame_number": 1,
          "field": "nas-5gs.mm.message_type",
          "observed_value": "0x41"
        }
      ],
      "proposed_owner_domain": "none",
      "correction_ref": null,
      "rationale": "Security mode command is observable as plain NAS (mm.message_type 0x5d, security_header_type 3) at frame 6, and every NAS message after it inside the window 1-17 exposes security_header_type 2 or 4 with no decodable message type, so the expected NAS security-mode completion is unobservable from this capture rather than proven absent.",
      "uncertainty": "Absence inside the observation window is not evidence that the counterpart was never sent; the message may sit inside a ciphered envelope or outside the capture.",
      "adjudication_id": "adj-01"
    },
    {
      "kind": "DOMAIN_DEVIATION",
      "source_domain": "5gc-registration-mobility",
      "source_instance_id": "5gc-reg:pdu-session-user-plane.pcap:sctp-assoc-65535:r1",
      "candidate_id": null,
      "deviation_type": "UNKNOWN_OR_RESERVED_PROTOCOL_VALUE",
      "stage_id": null,
      "status": "UNSUPPORTED_BY_PACKET_EVIDENCE",
      "finality": "FINAL",
      "evidence_level": "OBSERVED",
      "observation_ref": {
        "capture_file": "pdu-session-user-plane.pcap",
        "frame_number": 7,
        "window_first_frame": null,
        "window_last_frame": null,
        "protocol": "NAS-5GS",
        "message_type": null
      },
      "packet_evidence": [
        {
          "capture_file": "pdu-session-user-plane.pcap",
          "frame_number": 7,
          "field": "nas-5gs.security_header_type",
          "observed_value": "4"
        },
        {
          "capture_file": "pdu-session-user-plane.pcap",
          "frame_number": 7,
          "field": "nas-5gs.mm.message_type",
          "observed_value": "absent"
        }
      ],
      "proposed_owner_domain": "5gc-registration-mobility",
      "correction_ref": "corr-01",
      "rationale": "Frame 7 exposes NAS-5GS with security_header_type 4 and no decodable mm.message_type octet. The message-type byte is not present in the capture at all, so the packet evidence shows neither an unknown nor a reserved message-type value; the Domain republished the lower-layer UNKNOWN support status under a protocol-value label.",
      "uncertainty": "The lower-layer support_status UNKNOWN is itself accurate. Without the NAS security context the inner message type cannot be separated into unknown, reserved, or merely undecodable.",
      "adjudication_id": "adj-02",
      "equivalent_evidence_basis_ids": [
        "adj-03"
      ]
    },
    {
      "kind": "DOMAIN_DEVIATION",
      "source_domain": "5gc-registration-mobility",
      "source_instance_id": "5gc-reg:pdu-session-user-plane.pcap:sctp-assoc-65535:r1",
      "candidate_id": null,
      "deviation_type": "PROTECTED_INNER_MESSAGE_UNAVAILABLE",
      "stage_id": null,
      "status": "VALID_CAPTURE_LIMITATION",
      "finality": "FINAL",
      "evidence_level": "OBSERVED",
      "observation_ref": {
        "capture_file": "pdu-session-user-plane.pcap",
        "frame_number": 7,
        "window_first_frame": null,
        "window_last_frame": null,
        "protocol": "NAS-5GS",
        "message_type": null
      },
      "packet_evidence": [
        {
          "capture_file": "pdu-session-user-plane.pcap",
          "frame_number": 7,
          "field": "nas-5gs.security_header_type",
          "observed_value": "4"
        },
        {
          "capture_file": "pdu-session-user-plane.pcap",
          "frame_number": 7,
          "field": "nas-5gs.mm.message_type",
          "observed_value": "absent"
        }
      ],
      "proposed_owner_domain": "none",
      "correction_ref": null,
      "rationale": "Frame 7 carries a ciphered NAS-5GS envelope (security_header_type 4) whose inner message the dissector cannot reach, and the record states only that no decodable inner message was available. No message type, cause, or registration outcome was invented from the protected payload.",
      "uncertainty": "The protected payload may contain any NAS message; this adjudication asserts nothing about its contents and treats the envelope as unobservable rather than abnormal.",
      "adjudication_id": "adj-03",
      "equivalent_evidence_basis_ids": [
        "adj-02"
      ]
    },
    {
      "kind": "DOMAIN_DEVIATION",
      "source_domain": "5gc-registration-mobility",
      "source_instance_id": "5gc-reg:pdu-session-user-plane.pcap:sctp-assoc-65535:r1",
      "candidate_id": null,
      "deviation_type": "UNKNOWN_OR_RESERVED_PROTOCOL_VALUE",
      "stage_id": null,
      "status": "UNSUPPORTED_BY_PACKET_EVIDENCE",
      "finality": "FINAL",
      "evidence_level": "OBSERVED",
      "observation_ref": {
        "capture_file": "pdu-session-user-plane.pcap",
        "frame_number": 8,
        "window_first_frame": null,
        "window_last_frame": null,
        "protocol": "NAS-5GS",
        "message_type": null
      },
      "packet_evidence": [
        {
          "capture_file": "pdu-session-user-plane.pcap",
          "frame_number": 8,
          "field": "nas-5gs.security_header_type",
          "observed_value": "2"
        },
        {
          "capture_file": "pdu-session-user-plane.pcap",
          "frame_number": 8,
          "field": "nas-5gs.mm.message_type",
          "observed_value": "absent"
        }
      ],
      "proposed_owner_domain": "5gc-registration-mobility",
      "correction_ref": "corr-01",
      "rationale": "Frame 8 exposes NAS-5GS with security_header_type 2 and no decodable mm.message_type octet. The message-type byte is not present in the capture at all, so the packet evidence shows neither an unknown nor a reserved message-type value; the Domain republished the lower-layer UNKNOWN support status under a protocol-value label.",
      "uncertainty": "The lower-layer support_status UNKNOWN is itself accurate. Without the NAS security context the inner message type cannot be separated into unknown, reserved, or merely undecodable.",
      "adjudication_id": "adj-04",
      "equivalent_evidence_basis_ids": [
        "adj-05"
      ]
    },
    {
      "kind": "DOMAIN_DEVIATION",
      "source_domain": "5gc-registration-mobility",
      "source_instance_id": "5gc-reg:pdu-session-user-plane.pcap:sctp-assoc-65535:r1",
      "candidate_id": null,
      "deviation_type": "PROTECTED_INNER_MESSAGE_UNAVAILABLE",
      "stage_id": null,
      "status": "VALID_CAPTURE_LIMITATION",
      "finality": "FINAL",
      "evidence_level": "OBSERVED",
      "observation_ref": {
        "capture_file": "pdu-session-user-plane.pcap",
        "frame_number": 8,
        "window_first_frame": null,
        "window_last_frame": null,
        "protocol": "NAS-5GS",
        "message_type": null
      },
      "packet_evidence": [
        {
          "capture_file": "pdu-session-user-plane.pcap",
          "frame_number": 8,
          "field": "nas-5gs.security_header_type",
          "observed_value": "2"
        },
        {
          "capture_file": "pdu-session-user-plane.pcap",
          "frame_number": 8,
          "field": "nas-5gs.mm.message_type",
          "observed_value": "absent"
        }
      ],
      "proposed_owner_domain": "none",
      "correction_ref": null,
      "rationale": "Frame 8 carries a ciphered NAS-5GS envelope (security_header_type 2) whose inner message the dissector cannot reach, and the record states only that no decodable inner message was available. No message type, cause, or registration outcome was invented from the protected payload.",
      "uncertainty": "The protected payload may contain any NAS message; this adjudication asserts nothing about its contents and treats the envelope as unobservable rather than abnormal.",
      "adjudication_id": "adj-05",
      "equivalent_evidence_basis_ids": [
        "adj-04"